<?xml version="1.0" encoding="utf-8"?>
<buildTools xmlns:xsi="http://www.w3.org/2001/XMLSchema-instance"
            xsi:noNamespaceSchemaLocation="schemas/build-tools.xsd"
            schemaVersion="6">
   <tool id="git" version="2.55.0.3" runtimeVersion="2.55.0.windows.3" required="always">
      <managed root="git-for-windows\2.55.0.3" executable="cmd\git.exe">
         <download url="https://github.com/git-for-windows/git/releases/download/v2.55.0.windows.3/PortableGit-2.55.0.3-64-bit.7z.exe"
                   archive="PortableGit-2.55.0.3-64-bit.7z.exe"
                   sha256="ab00566336b5472120f9a52d34f2e79c5406535792acb0548001ffd0bd090e5d"/>
         <extract executable="{Archive}">
            <argument value="-o{ManagedRoot}"/>
            <argument value="-y"/>
         </extract>
      </managed>
      <probe contains="git version 2.55.0.windows.3"><argument value="--version"/></probe>
   </tool>

   <tool id="bash" version="5.2" required="when-used">
      <managed root="git-for-windows\2.55.0.3" executable="bin\bash.exe">
         <download url="https://github.com/git-for-windows/git/releases/download/v2.55.0.windows.3/PortableGit-2.55.0.3-64-bit.7z.exe"
                   archive="PortableGit-2.55.0.3-64-bit.7z.exe"
                   sha256="ab00566336b5472120f9a52d34f2e79c5406535792acb0548001ffd0bd090e5d"/>
         <extract executable="{Archive}">
            <argument value="-o{ManagedRoot}"/>
            <argument value="-y"/>
         </extract>
      </managed>
      <probe contains="GNU bash"><argument value="--version"/></probe>
   </tool>

   <tool id="cmake" version="4.1.1" required="always">
      <discover executable="cmake.exe" path="false">
         <candidate path="{USERPROFILE}\Documents\Embarcadero\Studio\37.0\CatalogRepository\CMake-cb\4.1.1\bin\cmake.exe"/>
      </discover>
      <probe contains="cmake version 4.1.1"><argument value="--version"/></probe>
   </tool>

   <!-- Generic GN host tool. Resolve existing provisioned binaries without
        altering Skia's completed source or FSM state. A dedicated managed
        distribution needs a verified binary checksum before adoption. -->
   <tool id="gn" version="07d3c6f4dc290fae5ca6152ebcb37d6815c411ab" required="when-used">
      <!-- Source-built GN only. The Skia GN version cannot parse PDFium path_exists(). -->
      <discover executable="gn.exe" path="false">
         <candidate path="{ProductionRoot}\tools\gn\07d3c6f4dc290fae5ca6152ebcb37d6815c411ab\gn.exe"/>
      </discover>
   </tool>
   <tool id="ninja" version="1.13.2" required="always">
      <managed root="ninja\1.13.2" executable="ninja.exe">
         <download url="https://github.com/ninja-build/ninja/releases/download/v1.13.2/ninja-win.zip"
                   archive="ninja-1.13.2.zip"
                   sha256="07fc8261b42b20e71d1720b39068c2e14ffcee6396b76fb7a795fb460b78dc65"/>
      </managed>
      <probe contains="1.13.2"><argument value="--version"/></probe>
   </tool>

   <tool id="perl" version="5.42.2.1" runtimeVersion="5.42.2" required="always">
      <managed root="perl\5.42.2.1" executable="perl\bin\perl.exe">
         <download url="https://github.com/StrawberryPerl/Perl-Dist-Strawberry/releases/download/SP_54221_64bit/strawberry-perl-5.42.2.1-64bit-portable.zip"
                   archive="strawberry-perl-5.42.2.1-64bit-portable.zip"
                   sha256="32d83be90cf04b807cfb9477482bc36302cdee6f5b04cf57e81adecbd8f07898"/>
      </managed>
      <probe contains="v5.42.2"><argument value="-e"/><argument value="print $^V"/></probe>
   </tool>

   <tool id="python" version="3.14.7" required="always">
      <managed root="python\3.14.7-embedded" executable="python.exe">
         <download url="https://www.python.org/ftp/python/3.14.7/python-3.14.7-embed-amd64.zip"
                   archive="python-3.14.7-embed-amd64.zip"
                   sha256="d297e5ff019966817ad8502465176139f2d3d840fa4ed84b13bed399a6ab1f15"/>
         <extract executable="{ENV:SystemRoot}\System32\WindowsPowerShell\v1.0\powershell.exe">
            <argument value="-NoProfile"/><argument value="-NonInteractive"/><argument value="-ExecutionPolicy"/><argument value="Bypass"/><argument value="-File"/>
            <argument value="{ProductionRoot}\admin\programs\python\extract-build-python.ps1"/><argument value="{Archive}"/><argument value="{ManagedRoot}"/>
            <argument value="{ProductionRoot}\admin\programs\python\python314._pth"/><argument value="{ProductionRoot}\admin\programs\python\sitecustomize.py"/>
         </extract>
      </managed>
      <probe contains="Python 3.14.7"><argument value="--version"/></probe>
   </tool>

   <tool id="fonttools" version="4.65.0" required="when-used">
      <managed root="python-packages\fonttools\4.65.0"
               executable="fontTools\__init__.py">
         <download url="https://files.pythonhosted.org/packages/a1/2d/ee69affecd4bc81cb932a213438d4199fb48bf8ca6d664438ccc7f623c2a/fonttools-4.65.0-cp314-cp314-win_amd64.whl"
                   archive="fonttools-4.65.0-cp314-cp314-win_amd64.whl"
                   sha256="0aa8901db22875c831d6a91796549590d7e747da37438f38b69d771b668be445"/>
      </managed>
   </tool>

   <tool id="meson" version="1.12.0" required="always">
      <managed root="meson\1.12.0" executable="meson.py">
         <download url="https://files.pythonhosted.org/packages/source/m/meson/meson-1.12.0.tar.gz" archive="meson-1.12.0.tar.gz" sha256="88afe0c20e52030218924ac37d0c81c59b4b5f3ae3752c8c6d7470c7d365886c"/>
         <nativeExtract format="libarchive" root="meson-1.12.0"><require path="meson.py"/><require path="mesonbuild\mesonmain.py"/><require path="COPYING"/></nativeExtract>
      </managed>
      <launcher tool="python"><argument value="{ToolEntry}"/></launcher>
      <probe contains="1.12.0"><argument value="--version"/></probe>
   </tool>

   <!-- 2.5.25 has a documented parallel temp-file race in win_flex on Windows. -->
   <tool id="winflexbison" version="2.5.24" required="always">
      <managed root="winflexbison\2.5.24" executable="win_flex.exe">
         <download url="https://github.com/lexxmark/winflexbison/releases/download/v2.5.24/win_flex_bison-2.5.24.zip" archive="winflexbison-2.5.24.zip" sha256="39c6086ce211d5415500acc5ed2d8939861ca1696aee48909c7f6daf5122b505"/>
      </managed>
      <probe contains="2.6.4"><argument value="--version"/></probe>
   </tool>

   <tool id="pkg-config" version="0.28-1" runtimeVersion="0.28" required="always">
      <managed root="pkg-config-lite\0.28-1" executable="pkg-config-lite-0.28-1\bin\pkg-config.exe">
         <download url="https://sourceforge.net/projects/pkgconfiglite/files/0.28-1/pkg-config-lite-0.28-1_bin-win32.zip/download" archive="pkg-config-lite-0.28-1_bin-win32.zip" sha256="2038c49d23b5ca19e2218ca89f06df18fe6d870b4c6b54c0498548ef88771f6f"/>
      </managed>
      <probe contains="0.28"><argument value="--version"/></probe>
   </tool>

   <tool id="doxygen" version="1.18.0" required="always">
      <managed root="doxygen\1.18.0" executable="doxygen.exe">
         <download url="https://github.com/doxygen/doxygen/releases/download/Release_1_18_0/doxygen-1.18.0.windows.x64.bin.zip" archive="doxygen-1.18.0.windows.x64.bin.zip" sha256="e84f54cfd49ef06b0b16536056dbec0c496323de28abcce53a4269463de35eaf"/>
      </managed>
      <probe contains="1.18.0"><argument value="--version"/></probe>
   </tool>

   <!--
      Graphviz is part of the reproducible documentation toolchain, not a BCC64X target artifact.
      The official Windows ZIP contains the complete tools/libraries/plugins/runtime tree below its
      package directory Graphviz-15.1.1-win64. BuildEngine's built-in ZIP extraction preserves that
      directory, therefore the managed executable follows the package layout explicitly.
   -->
   <tool id="graphviz" version="15.1.1" required="always">
      <managed root="graphviz\15.1.1" executable="Graphviz-15.1.1-win64\bin\dot.exe">
         <download url="https://gitlab.com/api/v4/projects/4207231/packages/generic/graphviz-releases/15.1.1/windows_10_cmake_Release_Graphviz-15.1.1-win64.zip"
                   archive="Graphviz-15.1.1-win64.zip"
                   sha256="e8256ef077e601d9f284378d96cd17faa7910832cf6bb85c43005e66ec2f255e"/>
      </managed>
      <probe contains="graphviz version 15.1.1"><argument value="-V"/></probe>
   </tool>

   <!-- Local browser assets used by the BuildEngine Server Markdown view. -->
   <tool id="web-mermaid" version="11.17.2" required="always">
      <managed root="web\mermaid\11.17.2" executable="dist\mermaid.esm.min.mjs">
         <download url="https://cdn.jsdelivr.net/npm/mermaid@11.17.2/dist/mermaid.min.js"
                   archive="web-mermaid-11.17.2.js"
                   sha256="581ed7d74bd9048d0e3a91363927d72ef22942d7722546b27f7cc29e35390eb8"/>
         <extract executable="{ENV:SystemRoot}\System32\WindowsPowerShell\v1.0\powershell.exe">
            <argument value="-NoProfile"/><argument value="-NonInteractive"/><argument value="-ExecutionPolicy"/><argument value="Bypass"/><argument value="-File"/>
            <argument value="{ProductionRoot}\admin\programs\web\install-web-asset.ps1"/>
            <argument value="-Archive"/><argument value="{Archive}"/><argument value="-ManagedRoot"/><argument value="{ManagedRoot}"/>
            <argument value="-RelativePath"/><argument value="mermaid.min.js"/>
            <argument value="-AdditionalSource"/><argument value="{ProductionRoot}\admin\programs\web\mermaid.esm.min.mjs"/>
            <argument value="-AdditionalRelativePath"/><argument value="dist\mermaid.esm.min.mjs"/>
         </extract>
      </managed>
   </tool>

   <tool id="web-highlight" version="11.12.0" required="always">
      <managed root="web\highlight\11.12.0" executable="highlight.min.js">
         <download url="https://cdn.jsdelivr.net/npm/@highlightjs/cdn-assets@11.12.0/highlight.min.js"
                   archive="web-highlight-11.12.0.js"